{
  "kind": "infrawright.transform_catalog",
  "product": "zcc",
  "python_compatibility": {
    "html_unescape": {
      "entities": {
        "AElig": "\u00c6",
        "AElig;": "\u00c6",
        "AMP": "&",
        "AMP;": "&",
        "Aacute": "\u00c1",
        "Aacute;": "\u00c1",
        "Abreve;": "\u0102",
        "Acirc": "\u00c2",
        "Acirc;": "\u00c2",
        "Acy;": "\u0410",
        "Afr;": "\ud835\udd04",
        "Agrave": "\u00c0",
        "Agrave;": "\u00c0",
        "Alpha;": "\u0391",
        "Amacr;": "\u0100",
        "And;": "\u2a53",
        "Aogon;": "\u0104",
        "Aopf;": "\ud835\udd38",
        "ApplyFunction;": "\u2061",
        "Aring": "\u00c5",
        "Aring;": "\u00c5",
        "Ascr;": "\ud835\udc9c",
        "Assign;": "\u2254",
        "Atilde": "\u00c3",
        "Atilde;": "\u00c3",
        "Auml": "\u00c4",
        "Auml;": "\u00c4",
        "Backslash;": "\u2216",
        "Barv;": "\u2ae7",
        "Barwed;": "\u2306",
        "Bcy;": "\u0411",
        "Because;": "\u2235",
        "Bernoullis;": "\u212c",
        "Beta;": "\u0392",
        "Bfr;": "\ud835\udd05",
        "Bopf;": "\ud835\udd39",
        "Breve;": "\u02d8",
        "Bscr;": "\u212c",
        "Bumpeq;": "\u224e",
        "CHcy;": "\u0427",
        "COPY": "\u00a9",
        "COPY;": "\u00a9",
        "Cacute;": "\u0106",
        "Cap;": "\u22d2",
        "CapitalDifferentialD;": "\u2145",
        "Cayleys;": "\u212d",
        "Ccaron;": "\u010c",
        "Ccedil": "\u00c7",
        "Ccedil;": "\u00c7",
        "Ccirc;": "\u0108",
        "Cconint;": "\u2230",
        "Cdot;": "\u010a",
        "Cedilla;": "\u00b8",
        "CenterDot;": "\u00b7",
        "Cfr;": "\u212d",
        "Chi;": "\u03a7",
        "CircleDot;": "\u2299",
        "CircleMinus;": "\u2296",
        "CirclePlus;": "\u2295",
        "CircleTimes;": "\u2297",
        "ClockwiseContourIntegral;": "\u2232",
        "CloseCurlyDoubleQuote;": "\u201d",
        "CloseCurlyQuote;": "\u2019",
        "Colon;": "\u2237",
        "Colone;": "\u2a74",
        "Congruent;": "\u2261",
        "Conint;": "\u222f",
        "ContourIntegral;": "\u222e",
        "Copf;": "\u2102",
        "Coproduct;": "\u2210",
        "CounterClockwiseContourIntegral;": "\u2233",
        "Cross;": "\u2a2f",
        "Cscr;": "\ud835\udc9e",
        "Cup;": "\u22d3",
        "CupCap;": "\u224d",
        "DD;": "\u2145",
        "DDotrahd;": "\u2911",
        "DJcy;": "\u0402",
        "DScy;": "\u0405",
        "DZcy;": "\u040f",
        "Dagger;": "\u2021",
        "Darr;": "\u21a1",
        "Dashv;": "\u2ae4",
        "Dcaron;": "\u010e",
        "Dcy;": "\u0414",
        "Del;": "\u2207",
        "Delta;": "\u0394",
        "Dfr;": "\ud835\udd07",
        "DiacriticalAcute;": "\u00b4",
        "DiacriticalDot;": "\u02d9",
        "DiacriticalDoubleAcute;": "\u02dd",
        "DiacriticalGrave;": "`",
        "DiacriticalTilde;": "\u02dc",
        "Diamond;": "\u22c4",
        "DifferentialD;": "\u2146",
        "Dopf;": "\ud835\udd3b",
        "Dot;": "\u00a8",
        "DotDot;": "\u20dc",
        "DotEqual;": "\u2250",
        "DoubleContourIntegral;": "\u222f",
        "DoubleDot;": "\u00a8",
        "DoubleDownArrow;": "\u21d3",
        "DoubleLeftArrow;": "\u21d0",
        "DoubleLeftRightArrow;": "\u21d4",
        "DoubleLeftTee;": "\u2ae4",
        "DoubleLongLeftArrow;": "\u27f8",
        "DoubleLongLeftRightArrow;": "\u27fa",
        "DoubleLongRightArrow;": "\u27f9",
        "DoubleRightArrow;": "\u21d2",
        "DoubleRightTee;": "\u22a8",
        "DoubleUpArrow;": "\u21d1",
        "DoubleUpDownArrow;": "\u21d5",
        "DoubleVerticalBar;": "\u2225",
        "DownArrow;": "\u2193",
        "DownArrowBar;": "\u2913",
        "DownArrowUpArrow;": "\u21f5",
        "DownBreve;": "\u0311",
        "DownLeftRightVector;": "\u2950",
        "DownLeftTeeVector;": "\u295e",
        "DownLeftVector;": "\u21bd",
        "DownLeftVectorBar;": "\u2956",
        "DownRightTeeVector;": "\u295f",
        "DownRightVector;": "\u21c1",
        "DownRightVectorBar;": "\u2957",
        "DownTee;": "\u22a4",
        "DownTeeArrow;": "\u21a7",
        "Downarrow;": "\u21d3",
        "Dscr;": "\ud835\udc9f",
        "Dstrok;": "\u0110",
        "ENG;": "\u014a",
        "ETH": "\u00d0",
        "ETH;": "\u00d0",
        "Eacute": "\u00c9",
        "Eacute;": "\u00c9",
        "Ecaron;": "\u011a",
        "Ecirc": "\u00ca",
        "Ecirc;": "\u00ca",
        "Ecy;": "\u042d",
        "Edot;": "\u0116",
        "Efr;": "\ud835\udd08",
        "Egrave": "\u00c8",
        "Egrave;": "\u00c8",
        "Element;": "\u2208",
        "Emacr;": "\u0112",
        "EmptySmallSquare;": "\u25fb",
        "EmptyVerySmallSquare;": "\u25ab",
        "Eogon;": "\u0118",
        "Eopf;": "\ud835\udd3c",
        "Epsilon;": "\u0395",
        "Equal;": "\u2a75",
        "EqualTilde;": "\u2242",
        "Equilibrium;": "\u21cc",
        "Escr;": "\u2130",
        "Esim;": "\u2a73",
        "Eta;": "\u0397",
        "Euml": "\u00cb",
        "Euml;": "\u00cb",
        "Exists;": "\u2203",
        "ExponentialE;": "\u2147",
        "Fcy;": "\u0424",
        "Ffr;": "\ud835\udd09",
        "FilledSmallSquare;": "\u25fc",
        "FilledVerySmallSquare;": "\u25aa",
        "Fopf;": "\ud835\udd3d",
        "ForAll;": "\u2200",
        "Fouriertrf;": "\u2131",
        "Fscr;": "\u2131",
        "GJcy;": "\u0403",
        "GT": ">",
        "GT;": ">",
        "Gamma;": "\u0393",
        "Gammad;": "\u03dc",
        "Gbreve;": "\u011e",
        "Gcedil;": "\u0122",
        "Gcirc;": "\u011c",
        "Gcy;": "\u0413",
        "Gdot;": "\u0120",
        "Gfr;": "\ud835\udd0a",
        "Gg;": "\u22d9",
        "Gopf;": "\ud835\udd3e",
        "GreaterEqual;": "\u2265",
        "GreaterEqualLess;": "\u22db",
        "GreaterFullEqual;": "\u2267",
        "GreaterGreater;": "\u2aa2",
        "GreaterLess;": "\u2277",
        "GreaterSlantEqual;": "\u2a7e",
        "GreaterTilde;": "\u2273",
        "Gscr;": "\ud835\udca2",
        "Gt;": "\u226b",
        "HARDcy;": "\u042a",
        "Hacek;": "\u02c7",
        "Hat;": "^",
        "Hcirc;": "\u0124",
        "Hfr;": "\u210c",
        "HilbertSpace;": "\u210b",
        "Hopf;": "\u210d",
        "HorizontalLine;": "\u2500",
        "Hscr;": "\u210b",
        "Hstrok;": "\u0126",
        "HumpDownHump;": "\u224e",
        "HumpEqual;": "\u224f",
        "IEcy;": "\u0415",
        "IJlig;": "\u0132",
        "IOcy;": "\u0401",
        "Iacute": "\u00cd",
        "Iacute;": "\u00cd",
        "Icirc": "\u00ce",
        "Icirc;": "\u00ce",
        "Icy;": "\u0418",
        "Idot;": "\u0130",
        "Ifr;": "\u2111",
        "Igrave": "\u00cc",
        "Igrave;": "\u00cc",
        "Im;": "\u2111",
        "Imacr;": "\u012a",
        "ImaginaryI;": "\u2148",
        "Implies;": "\u21d2",
        "Int;": "\u222c",
        "Integral;": "\u222b",
        "Intersection;": "\u22c2",
        "InvisibleComma;": "\u2063",
        "InvisibleTimes;": "\u2062",
        "Iogon;": "\u012e",
        "Iopf;": "\ud835\udd40",
        "Iota;": "\u0399",
        "Iscr;": "\u2110",
        "Itilde;": "\u0128",
        "Iukcy;": "\u0406",
        "Iuml": "\u00cf",
        "Iuml;": "\u00cf",
        "Jcirc;": "\u0134",
        "Jcy;": "\u0419",
        "Jfr;": "\ud835\udd0d",
        "Jopf;": "\ud835\udd41",
        "Jscr;": "\ud835\udca5",
        "Jsercy;": "\u0408",
        "Jukcy;": "\u0404",
        "KHcy;": "\u0425",
        "KJcy;": "\u040c",
        "Kappa;": "\u039a",
        "Kcedil;": "\u0136",
        "Kcy;": "\u041a",
        "Kfr;": "\ud835\udd0e",
        "Kopf;": "\ud835\udd42",
        "Kscr;": "\ud835\udca6",
        "LJcy;": "\u0409",
        "LT": "<",
        "LT;": "<",
        "Lacute;": "\u0139",
        "Lambda;": "\u039b",
        "Lang;": "\u27ea",
        "Laplacetrf;": "\u2112",
        "Larr;": "\u219e",
        "Lcaron;": "\u013d",
        "Lcedil;": "\u013b",
        "Lcy;": "\u041b",
        "LeftAngleBracket;": "\u27e8",
        "LeftArrow;": "\u2190",
        "LeftArrowBar;": "\u21e4",
        "LeftArrowRightArrow;": "\u21c6",
        "LeftCeiling;": "\u2308",
        "LeftDoubleBracket;": "\u27e6",
        "LeftDownTeeVector;": "\u2961",
        "LeftDownVector;": "\u21c3",
        "LeftDownVectorBar;": "\u2959",
        "LeftFloor;": "\u230a",
        "LeftRightArrow;": "\u2194",
        "LeftRightVector;": "\u294e",
        "LeftTee;": "\u22a3",
        "LeftTeeArrow;": "\u21a4",
        "LeftTeeVector;": "\u295a",
        "LeftTriangle;": "\u22b2",
        "LeftTriangleBar;": "\u29cf",
        "LeftTriangleEqual;": "\u22b4",
        "LeftUpDownVector;": "\u2951",
        "LeftUpTeeVector;": "\u2960",
        "LeftUpVector;": "\u21bf",
        "LeftUpVectorBar;": "\u2958",
        "LeftVector;": "\u21bc",
        "LeftVectorBar;": "\u2952",
        "Leftarrow;": "\u21d0",
        "Leftrightarrow;": "\u21d4",
        "LessEqualGreater;": "\u22da",
        "LessFullEqual;": "\u2266",
        "LessGreater;": "\u2276",
        "LessLess;": "\u2aa1",
        "LessSlantEqual;": "\u2a7d",
        "LessTilde;": "\u2272",
        "Lfr;": "\ud835\udd0f",
        "Ll;": "\u22d8",
        "Lleftarrow;": "\u21da",
        "Lmidot;": "\u013f",
        "LongLeftArrow;": "\u27f5",
        "LongLeftRightArrow;": "\u27f7",
        "LongRightArrow;": "\u27f6",
        "Longleftarrow;": "\u27f8",
        "Longleftrightarrow;": "\u27fa",
        "Longrightarrow;": "\u27f9",
        "Lopf;": "\ud835\udd43",
        "LowerLeftArrow;": "\u2199",
        "LowerRightArrow;": "\u2198",
        "Lscr;": "\u2112",
        "Lsh;": "\u21b0",
        "Lstrok;": "\u0141",
        "Lt;": "\u226a",
        "Map;": "\u2905",
        "Mcy;": "\u041c",
        "MediumSpace;": "\u205f",
        "Mellintrf;": "\u2133",
        "Mfr;": "\ud835\udd10",
        "MinusPlus;": "\u2213",
        "Mopf;": "\ud835\udd44",
        "Mscr;": "\u2133",
        "Mu;": "\u039c",